{
  "schemaVersion": 1,
  "runtimeTemplate": {
    "repository": "shinyay/github-copilot-customization-runtime-template",
    "minimumTemplateVersion": 1,
    "versionMarker": ".hackathon/template.json"
  },
  "sourceBaseline": {
    "repository": "shinyay/code-to-doc-workshop-260910",
    "commit": "398d7d1982a1402bcdba00d6c3ded67d8d338787",
    "fileCount": 515,
    "treeSha256": "c3cd74e0d65b1ae88a29a4392eb42f9d51ba2c671d111796aacc69fd9cc5b111"
  },
  "authoringReference": {
    "repository": "shinyay/github-copilot-customization-labs",
    "vendoredSourcePath": "fixtures/tsubame-wholesale"
  },
  "releasePlan": {
    "waves": [
      [
        "HC-002",
        "HC-003",
        "HC-004",
        "HC-005",
        "HC-008"
      ],
      [
        "HC-010",
        "HC-012",
        "HC-013",
        "HC-014",
        "HC-015"
      ],
      [
        "HC-016",
        "HC-017",
        "HC-018",
        "HC-019",
        "HC-020"
      ],
      [
        "HC-021",
        "HC-022",
        "HC-023",
        "HC-024",
        "HC-025"
      ],
      [
        "HC-026",
        "HC-027",
        "HC-028",
        "HC-029",
        "HC-031"
      ],
      [
        "HC-032",
        "HC-033",
        "HC-034",
        "HC-035",
        "HC-036"
      ],
      [
        "HC-037",
        "HC-038",
        "HC-039",
        "HC-040",
        "HC-041"
      ],
      [
        "HC-042",
        "HC-043",
        "HC-044",
        "HC-045"
      ]
    ],
    "reviewBetweenWaves": true,
    "participantPrerequisite": false
  },
  "challenges": [
    {
      "id": "HC-001",
      "title": "根拠を大切にするJavaチームメイトを育てよう",
      "track": "instructions",
      "status": "published",
      "sourceLab": {
        "ids": [
          "LAB-01"
        ],
        "repository": "shinyay/github-copilot-customization-labs",
        "pages": [
          "docs/labs/lab-01-repository-instructions.md"
        ]
      },
      "sourceKind": "baseline",
      "optionalRoutes": [],
      "sourcePaths": [
        "wholesale-core/src/main/java/jp/co/tsubame/wholesale/common/Money.java",
        "wholesale-core/src/test/java/jp/co/tsubame/wholesale/common/CommonRulesTest.java"
      ],
      "challengeVersion": 1,
      "page": "challenges/hc-001/README.md",
      "pack": "challenges/hc-001/pack",
      "feature": "Repository Instructions",
      "support": {
        "primary": "Repository Instructions",
        "fallback": "公開checklistをtaskへ貼るmanual-equivalent"
      },
      "isolation": {
        "tier": "repository",
        "conditionStrategy": "separate-repository"
      }
    },
    {
      "id": "HC-002",
      "title": "JavaとXMLに別々の読み方を教えよう",
      "track": "instructions",
      "status": "published",
      "sourceLab": {
        "ids": [
          "LAB-02"
        ],
        "repository": "shinyay/github-copilot-customization-labs",
        "pages": [
          "docs/labs/lab-02-file-task-instructions.md"
        ]
      },
      "sourceKind": "baseline",
      "optionalRoutes": [],
      "sourcePaths": [
        "wholesale-core/src/main/java/jp/co/tsubame/wholesale/service/OrderService.java",
        "wholesale-core/src/main/java/jp/co/tsubame/wholesale/service/BaseService.java",
        "wholesale-core/src/main/java/jp/co/tsubame/wholesale/common/Actor.java",
        "wholesale-core/src/main/resources/application-context.xml",
        "wholesale-core/src/main/resources/spring/module-operations.xml"
      ],
      "challengeVersion": 1,
      "page": "challenges/hc-002/README.md",
      "pack": "challenges/hc-002/pack",
      "feature": "File/task Instructions",
      "support": {
        "primary": "VS Code Stableの明示applyTo付きFile/task Instructions",
        "fallback": "凍結した二本文の全文を貼るmanual-equivalent。自動適用の未観測・unsupportedは分離する"
      },
      "isolation": {
        "tier": "repository",
        "conditionStrategy": "separate-repository"
      }
    },
    {
      "id": "HC-003",
      "title": "ディレクトリごとのルールをAGENTS.mdで伝えよう",
      "track": "instructions",
      "status": "published",
      "sourceLab": {
        "ids": [
          "LAB-03"
        ],
        "repository": "shinyay/github-copilot-customization-labs",
        "pages": [
          "docs/labs/lab-03-agents-md.md"
        ]
      },
      "sourceKind": "baseline",
      "sourcePaths": [
        "wholesale-core/src/main/java/jp/co/tsubame/wholesale/service/OrderService.java",
        "wholesale-core/src/main/java/jp/co/tsubame/wholesale/service/BaseService.java",
        "wholesale-core/src/main/java/jp/co/tsubame/wholesale/common/Actor.java"
      ],
      "optionalRoutes": [
        {
          "id": "nested-discovery",
          "title": "入れ子のAGENTS.md発見を別実験として準備する",
          "page": "challenges/hc-003/optional/nested-discovery.md",
          "required": false,
          "prerequisites": {
            "environment": [
              "Experimentalなnested AGENTS.mdの説明と、利用予定のVS Code・harnessの対応状況を確認できること。",
              "本編とは別の使い捨てworkspaceと新規会話を用意できること。"
            ],
            "entitlements": [
              "利用予定環境のGitHub Copilotと教材repositoryへの通常の利用資格を確認できること。"
            ],
            "additionalApprovals": [
              "Experimental機能を扱う独立した実機計画は、環境所有者の追加承認を得ること。"
            ]
          },
          "runtimeRequirements": [
            {
              "capability": "nested-agents-discovery",
              "status": "not-checked",
              "reason": "入れ子ファイルの発見・本文投入とRuntimeによる任意実機検証は未確認です。"
            }
          ],
          "liveStatus": "live-unobserved",
          "stopReasons": [
            "対応状況または追加承認が確認できない場合は実機計画を止めます。",
            "本編のroot条件、既存設定、許可pathを変更しなければ試せない場合は未実施にします。"
          ]
        },
        {
          "id": "parent-discovery",
          "title": "親repositoryの発見条件を確認する",
          "page": "challenges/hc-003/optional/parent-discovery.md",
          "required": false,
          "prerequisites": {
            "environment": [
              "開くworkspace rootと親repositoryの境界を、実行せず図で区別できること。",
              "workspace自身には.gitフォルダーがなく、親に.gitフォルダーがあるという公式の前提を確認できること。"
            ],
            "entitlements": [
              "教材と親repositoryを閲覧する通常の権限を確認できること。"
            ],
            "additionalApprovals": [
              "親repositoryを信頼してよいかは所有者が判断し、追加の実機計画を承認すること。"
            ]
          },
          "runtimeRequirements": [
            {
              "capability": "parent-repository-discovery",
              "status": "not-checked",
              "reason": "親探索、trust、投入元とRuntimeによる任意実機検証の組合せは未確認です。"
            }
          ],
          "liveStatus": "live-unobserved",
          "stopReasons": [
            "親の信頼性、所有者の承認、workspace境界のいずれかが不明なら止めます。",
            "既存の親ファイルやhomeの変更、trustの迂回が必要なら未実施にします。"
          ]
        }
      ],
      "challengeVersion": 1,
      "page": "challenges/hc-003/README.md",
      "pack": "challenges/hc-003/pack",
      "feature": "AGENTS.md",
      "support": {
        "primary": "root AGENTS.md一つの指示文書と同本文の手動対照",
        "fallback": "凍結した本文全文を手動供給し、発見・投入の未観測を分けて報告"
      },
      "isolation": {
        "tier": "repository",
        "conditionStrategy": "separate-repository"
      }
    },
    {
      "id": "HC-004",
      "title": "Claude形式の指示を安全に持ち込もう",
      "track": "instructions",
      "status": "published",
      "sourceLab": {
        "ids": [
          "LAB-04"
        ],
        "repository": "shinyay/github-copilot-customization-labs",
        "pages": [
          "docs/labs/lab-04-claude-instruction-formats.md"
        ]
      },
      "sourceKind": "baseline",
      "sourcePaths": [
        "wholesale-core/src/main/java/jp/co/tsubame/wholesale/service/OrderService.java",
        "wholesale-core/src/main/java/jp/co/tsubame/wholesale/service/BaseService.java",
        "wholesale-core/src/main/java/jp/co/tsubame/wholesale/common/Actor.java"
      ],
      "optionalRoutes": [
        {
          "id": "claude-variants",
          "title": "localとRulesの互換形式を別々に準備する",
          "page": "challenges/hc-004/optional/claude-variants.md",
          "required": false,
          "prerequisites": {
            "environment": [
              "localとRulesを分けた使い捨てworkspaceと新規会話を計画できること。",
              "利用予定のVS Code・harnessとClaude互換形式の対応状況を確認できること。"
            ],
            "entitlements": [
              "利用予定環境のGitHub Copilotと教材repositoryへの通常の利用資格を確認できること。"
            ],
            "additionalApprovals": [
              "localまたはRulesの独立した実機計画には、環境所有者の追加承認を得ること。"
            ]
          },
          "runtimeRequirements": [
            {
              "capability": "claude-local-discovery",
              "status": "not-checked",
              "reason": "localの発見・本文投入とGit除外の実状態は未確認です。"
            },
            {
              "capability": "claude-rules-discovery",
              "status": "not-checked",
              "reason": "paths配列によるRulesの選択・本文投入とRuntimeによる任意実機検証は未確認です。"
            }
          ],
          "liveStatus": "live-unobserved",
          "stopReasons": [
            "対応状況、分離環境、追加承認が確認できない場合は実機計画を止めます。",
            "homeの変更、除外設定の書換え、本編へのactive Rules追加が必要なら未実施にします。"
          ]
        }
      ],
      "challengeVersion": 1,
      "page": "challenges/hc-004/README.md",
      "pack": "challenges/hc-004/pack",
      "feature": "CLAUDE.md compatible instructions",
      "support": {
        "primary": "model・harnessを固定したroot CLAUDE.md一つの互換形式比較",
        "fallback": "凍結した本文全文を手動供給し、互換形式の発見成功とは区別"
      },
      "isolation": {
        "tier": "repository",
        "conditionStrategy": "separate-repository"
      }
    },
    {
      "id": "HC-005",
      "title": "個人・チーム・タスクの指示を整理しよう",
      "track": "instructions",
      "status": "published",
      "sourceLab": {
        "ids": [
          "LAB-05"
        ],
        "repository": "shinyay/github-copilot-customization-labs",
        "pages": [
          "docs/labs/lab-05-shared-task-instructions.md"
        ]
      },
      "sourceKind": "synthetic",
      "sourcePaths": [],
      "challengeVersion": 1,